{
  "workflow_id": "mace-evaluation-slurm",
  "step_id": "request_submission_approval",
  "manifest_id": "mace-interatomic-potential",
  "command_template_id": "execution.slurm.submit_command",
  "command_source": "reviewed-wrapper",
  "reviewed_wrapper": {
    "path": "examples/slurm-mace-evaluation/job.sbatch.template",
    "review_status": "reviewed",
    "reviewed_by": "OpenSciFlow maintainers",
    "allowed_arguments": [
      "run_directory",
      "account",
      "partition",
      "time_limit",
      "cpu_cores",
      "memory_gb",
      "gpu_resources",
      "module"
    ]
  },
  "rendered_command": "sbatch runs/mace-eval-slurm-001/job.sbatch",
  "inputs": [
    { "name": "configs_xyz", "path": "/shared/project/inputs/configs.extxyz", "sha256": "mock-configs-hash" },
    { "name": "model_file", "path": "/shared/models/mace.model", "sha256": "mock-model-hash" }
  ],
  "outputs": [
    { "name": "evaluated_configs", "path": "/shared/project/runs/mace-eval-slurm-001/evaluated_configs.xyz" },
    { "name": "execution_log", "path": "/shared/project/runs/mace-eval-slurm-001/mace-eval.log" },
    { "name": "slurm_stdout", "path": "/shared/project/runs/mace-eval-slurm-001/slurm-%j.out" },
    { "name": "slurm_stderr", "path": "/shared/project/runs/mace-eval-slurm-001/slurm-%j.err" },
    { "name": "run_record", "path": "/shared/project/runs/mace-eval-slurm-001/run-record.json" }
  ],
  "run_directory": "/shared/project/runs/mace-eval-slurm-001",
  "environment": {
    "mode": "slurm",
    "scheduler": "slurm",
    "account": "user-provided-account",
    "partition": "user-provided-gpu-partition",
    "time_limit": "01:00:00",
    "cpu_cores": 4,
    "memory_gb": 16,
    "gpu_resources": "gpu:1",
    "module": "mace/0.3",
    "modules": ["mace/0.3"],
    "required_commands": ["sbatch", "mace_eval_configs"]
  },
  "dry_run": true,
  "approval_status": "pending"
}
